Question	Answer	Source
Предоставление отчета для менеджера по определенной форме	**Требования к шаблону. Шаблон должен содержать следующую информацию: ***   Виды процедур, по которым должен быть сформирован отчет;\n*   Список Заказчиков (в случае, если отчет предоставляется по определенным заказчикам); \n*   Индивидуальные требования (экономия, преимущества и др.);\n*   Периодичность предоставления (разовый, ежедневный, ежемесячный, квартальный, полугодовой годовой и др.).Все вышеуказанные требования установлены Департаментом информационной безопасности.	Editorial
Выгрузка отчета	1.  Осуществите вход в Личный кабинет Оператора по электронной подписи;\n2.  Перейдите в раздел "Администрирование", далее в раздел "Управление отчетами";\n3.  В реестре Заказчиков осуществите поиск необходимой организации и откройте карточку организации;\n4.  Установите галочку в чек-бокс "Просмотр отчета". После предоставления доступа в разделе "Отчеты" Вы можете сформировать отчеты по следующим параметрам:*   "Собственные закупки" - в данном отчете отображаются закупки, которые были размещены Заказчиком "для себя";\n*   "Закупки подведомственных организаций (ГРБС)" - в данном отчете отображаются закупки, которые были размещены для подведомственных организаций;\n*   "Закупки региона" - в данном отчете отображаются закупки, которые были размещены всеми Заказчиками региона;\n*   "Организованные процедуры" - в данном отчете отображаются закупки, которые были организованы запрашивающей отчет организацией.Для формирования отчета:1.  В разделе "Отчеты" выберите нужный тип отчета;\n2.  При необходимости укажите период, за который требуется предоставить отчет (максимальный период - 1 год);\n3.  Нажмите кнопку "Запросить отчет".Сформируется отчет, который отобразится в таблице. Вы можете сформированный отчет просмотреть или выгрузить в Excel.Если уже имеется отчет в статусе "Формируется", то запросить следующий отчет возможно только после полного формирования первого. При формировании отчета загрузка происходит автоматически, независимо от того, находится пользователь в личном кабинете площадки на момент выгрузки или нет.Запросы, находящиеся в статусе "Формирование", можно удалить. Для этого в разделе "Отчеты" в строке с запросом на формирование отчета в столбце "Действия с отчетом" нажмите кнопку "Отмена".	Editorial
Интеграция информации между электронной площадкой и региональными программными системами	1.  Если при интеграции каких-либо сведений произошла ошибка, запросите полный текст ошибки на электронную почту support@rts-tender.ru или подключитесь удаленно и сделайте скрин-шот ошибки;\n2.  Если ошибка не возникает, но Пользователь утверждает, что проблема с интеграцией существует, рекомендуйте обратиться в службу техподдержки регионального ПО;\n3.  Уточните, что со своей стороны должна сделать площадка;\n4.  Поставьте задачу на 3 линию техподдержки с подробным описанием проблемы (укажите номер аукциона, название регионального ПО, контакты брать не требуется);\n5.  Сообщите ответ Пользователю:** **<span style="color:#1f497d;">С</span>ведения с электронной площадки (заявки участников, запросы на разъяснение, протоколы и др.) передаются автоматически по запросу региональных информационных систем. <span style="font-family:calibri, sans-serif;font-size:11pt;">Периодичность направления запроса сведений задается на усмотрение информационной системы. Информация в любом случае будет передна техническим специалистам и проверена ими</span>.	Editorial
Действия связаны с автоматизированной системой БФТ 	<strong style="line-height:1.6">Причина: **<span style="line-height:1.6">Сообщение говорит о работе Заказчика с региональным ПО. </span>\n\n</strong>**Решение: **При нажатии кнопки "Нет" появится возможность выполнить действие сразу через площадку.	Editorial
Работа в региональном ПО	Для уточнения информации о работе в региональном ПО обратитесь в службу техподдержки регионального ПО.	Editorial
Контакты региональных ПО	 Каждое региональное ПО имеет своих представителей. Информацией об их контактах мы не обладаем. Вам необходимо самостоятельно уточнять данную информацию.	Editorial
Не интегрируется информация по аукционам и возникает ошибка rtsexchange через АЦК  	**Причина: **Ошибка возникает ввиду указания тега "Почтовый адрес"   (offers/purchoffer/postaddress), **  **в xml, который по xsd-схеме не поддерживается. **Решение:** Рекомендуйте связаться с техническими специалистами Регионального программного обеспечения, для того, чтобы тег "Почтовый адрес" не указывался при отправке xml  с протоколом на площадку.	Editorial
Предоставление доступа к API заказчика	**Действия Оператора:** При поступлении обращения с просьбой настройки интеграции между электронной площадкой РТС-тендер и ВСРЗ (региональное ПО) необходимо поставить задачу по шаблону [http://megaplan.rts-tender.ru/task/add/?tid=1098822](http://megaplan.rts-tender.ru/task/add/?tid=1098822) (Предоставление доступа к API заказчика).Задача на предоставление доступа к API Заказчика должна содержать следующую информацию:1.  Суть изменения.\n2.  Контактные данные организации:*   наименование организации (наименование организации, для которой выполняется настройка интеграции);\n*   ИНН организации1.  Контактное лицо:*   ФИО контактного лица;\n*   адрес электронной почты;\n*   номер телефона.1.  Дополнительная информация (указать регион, в котором будет работать ВСРЗ, перечень заказчиков, которые уже работают с данным ВСРЗ).	Editorial
Контакты представительств	Контактные сведения о представительствах ООО "РТС-тендер" доступны на сайте РТС-тендер в разделе "О компании", далее "[Контакты](http://www.rts-tender.ru/about/contacts)".Раздел "Контакты" содержит сведения о филиалах и представительствах, а также адреса электронной почты.	Editorial
Контакты ЭП РТС-тендер	"Сведения о контактах компании РТС-тендер и ее представительствах можно посмотреть на главной странице сайта www.rts-tender.ru в разделе "О компании" / "Контакты".Генеральный директор ООО "РТС-тендер" - Лишенков Владимир Николаевич**Центральный офис**Контактный номер телефона:+7 (800) 77-55-800 (звонок по России бесплатный); <span dir="ltr"><span dir="ltr">+7 (499) 653-55-00</span></span> - прямой городской номер для жителей Москвы и Московской области (звонки из других регионов тарифицируются как межгород)+7(495) 733-9519 - факс. Юридический и почтовый адрес: 121151, г. Москва, набережная Тараса Шевченко, д. 23-АФактический адрес: 121151, г. Москва, набережная Тараса Шевченко, д.23-А, Бизнес-центр "Башня 2000", 25 этаж**Сибирский филиал «РТС-тендер»**Контактный номер телефона:  <span dir="ltr"><span dir="ltr">+7 (3852) 200-787</span></span> - офис+7 (3852) 220-712 - факс Адрес: 656056, г. Барнаул, ул. М. Горького, д. 29**Трудоустройство**Если Вас интересует работа в филиалах и представительствах нашей компании, расположенных в Сибирском и Дальневосточном федеральных округах, обращайтесь по телефону <span dir="ltr"><span dir="ltr">+7 (3852) 200-787</span></span> доб. 33004 или напишите письмо на [sf.common@rts-tender.ru](mailto:sf.common@rts-tender.ru)."	Editorial
Контакты сторонних организаций 	**Крипто-ПРО: **Тел./факс: +7 (495) 995- 48-20, +7 (495) 984-07-90 Email: info@cryptopro.ruТехническая поддержка:+7 (495) 995-48-21, +7 (495) 984-07-89, Email: [https://support.cryptopro.ru/](https://support.cryptopro.ru/ "Портал технической поддержки КРИПТО-ПРО")Почтовый адрес: 127018, г. Москва, а/я "КРИПТО-ПРО" (б/н).**Ассоциация электронных торговых площадок:**Тел.: 8-800-2000-100Сайт: aetp.ru	Editorial
Адреса электронной почты (vTiger  CRM) 	*   Для Заказчиков - [support@rts-tender.ru](mailto:support@rts-tender.ru);\n*   Для Поставщиков и иных пользователей - [info@rts-tender.ru](mailto:info@rts-tender.ru);\n*   Для официальных документов от контролирующих органов, судебных документов - [ko@rts-tender.ru](mailto:ko@rts-tender.ru)\n*   По вопросам в области сотрудничества, продаж и продвижения - [sales@rts-tender.ru](mailto:sales@rts-tender.ru);\n*   По вопросам обучения, проведения и участия в семинарах, размещению обучающих материалов - [academy@rts-tender.ru](mailto:academy@rts-tender.ru);\n*   По вопросам кредитования - [credit@rts-tender.ru](mailto:credit@rts-tender.ru);\n*   По вопросам  размещения депозитов - [capital@rts-tender.ru;](mailto:capital@rts-tender.ru)\n*   По вопросам СМИ - [marketing@rts-tender.ru.](mailto:marketing@rts-tender.ru)	Editorial
Система ЕАСУЗ	 По вопросам, касающимся работы в системе ЕАСУЗ, Вам необходимо обратиться в службу технической поддержки ЕАСУЗ. Контакты технической службы поддержки ЕАСУЗ (осуществление консультаций по 44-ФЗ): Тел.: [495] 544-97-76 (доб. #2) Email: supporteasuz@granit.ru	Editorial
Контакты Официального сайта РФ	**Официальный сайт РФ: **zakupki.gov.ruhelpdesk@zakupki.gov.ruТел.: 8 800 333-81-11, 8 495 811-03-33.	Editorial
Контакты УЦ "FT-crypto"	Полное наименование: Общество с ограниченной ответственностью "Финтендер-крипто" (ООО "Финтендер-крипто")Телефон: 8 (499)-653-57-00.E-mail: uc@ft-crypto.ru.График работы техподдержки: С 05.00 до 19.00 МСК.	Editorial
Контакты ОТС-Маркет	На данный момент ОТС-Маркет не является партнером РТС-тендер. Для получения консультации Вы можете обратиться по телефонам, размещенным на сайте ОТС-Маркет.	Editorial
Контакты РТС-тендер по 223-ФЗ	<span style="color:#000000;font-family:calibri, arial, helvetica, sans-serif;font-size:14px;"> </span>Вы позвонили в техническую поддержку Электронной площадки РТС-тендер работающей по 44-ФЗ. Для получения информации по работе на площадке РТС-тендер по 223-ФЗ и коммерческим закупкам Вам необходимо обратиться по номеру телефона + 7 (499) 653-9-900. Режим работы линии: с 5:00 до 19:00 по МСКАдреса электронной почты:[info223@rts-tender.ru](mailto:info223@rts-tender.ru) - поддержка Участников[support223@rts-tender.ru](mailto:support223@rts-tender.ru) - поддержка Заказчиков.	Editorial
Порядок обращения сотрудников в Контакт-центр	Режим работы:Группа технической поддержки (Участников закупки), работающих по 44-ФЗ  - круглосуточно.Группа сопровождения Заказчиков, работающих по 44-ФЗ с 02.00 до 20.00 по московскому времени, выходные - суббота, воскресенье.Группы технической поддержки  ЭП по 223-ФЗ, 615 ПП РФ с 05.00 до 19.00 по московскому времени, выходные - суббота, воскресенье.Группы технической поддержки  ЭП РТС-тендер Имущественные торги с 05.00 до 19.00 по московскому времени, выходные - суббота, воскресенье.Для обращения по телефону:1.  Позвоните на  номер 8-804-333-15-03;\n2.  В голосовом меню набрите цифру "1"/"2"/"3"/"4":"1" - по вопросам Заказчика/Уполномоченного органа, работающего по 44-ФЗ;"2" - по вопросам Участника закупки, работающего по 44-ФЗ;"3" - по вопросам Заказчика/Уполномоченного органа/ Участника закупки, работающего по 223-ФЗ, 615 ПП РФ;"4" - по вопросам Покупателя/ Продавца, работающего на ЭП РТС-тендер Имущественные торги.Для обращения  по электронной почте необходимо направить письмо на соответственный адрес электронный почты: [support@rts-tender.ru](mailto:support@rts-tender.ru) – адрес электронной почты для сопровождения заказчиков/УО, работающих по 44-ФЗ;[info@rts-tender.ru](mailto:info@rts-tender.ru) – адрес электронной почты для сопровождения участников, работающих по 44-ФЗ;[support223@rts-tender.ru](mailto:support223@rts-tender.ru) – адрес электронной почты для сопровождения заказчиков/УО, работающих по 223-ФЗ;[info223@rts-tender.ru](mailto:info223@rts-tender.ru) – адрес электронной почты для сопровождения участников, работающих по 223-ФЗ;[iSupport@rts-tender.ru](mailto:iSupport@rts-tender.ru) - адрес электронной почты для сопровождения продавцов/покупателей, работающих на ЭП РТС-тендер Имущественные торги.	Editorial
Контакты ЭП РТС-тендер Имущественные торги	Вы позвонили в техническую поддержку Электронной площадки РТС-тендер работающей по 44-ФЗ. Для получения информации по работе на площадке** **РТС-тендер Имущественные торги Вам необходимо обратиться по номеру телефона +7 (499) 653-77-00 или по адресу электронной почты [iSupport@rts-tender.ru](mailto:iSupport@rts-tender.ru).	Editorial
Контакты РТС-тендер по 615-ПП РФ	<span style="color:#000000;font-family:calibri, arial, helvetica, sans-serif;font-size:14px;"> </span>Вы позвонили в техническую поддержку Электронной площадки РТС-тендер работающей по 44-ФЗ. Для получения информации по работе на площадке РТС-тендер по Постановлению правительства РФ № 615 Вам необходимо обратиться по номеру телефона + 7 (499) 653-9-900. Режим работы линии: с 5:00 до 19:00 по МСК	Editorial
Контакты Fintender	В случае возникновения вопросов по получению услуг финансового сопровождения и корректному заполнению заявки Вы можете получить консультацию по телефону +7 (499) 648-00-88 или электронной почте fs@rts-tender.ru.Контакты техподдержки сервиса Fintender : 8-800-5555-412, для Москвы и Московской области 8-499-702-3222.	Editorial
Не по адресу, сорвался звонок,  абонент не отвечает, тишина или музыка в трубке, ошиблись номером		Editorial
Перевод звонка на другого абонента 	**Дейсвтия Оператора: **При переводе звонка на другого абонента, Оператор заносит сведения об организации в обращение и разрешает его (по ситуации).	Editorial
Юридическая консультация 	В случае обращения Заказчика по вопросу:*   Комментарий к Закону;\n*   Предоставление документов на аукцион;\n*   Причины отклонения заявок;\n*   Установление цены в контракте;\n*   Выбор обеспечения контракта;\n*   Расторжение контракта и т.п.Оператор рекомендует обратится к юристу организации клиента или к юристу, осуществляющему консультации на платной основе.	Editorial
Уточнение информации по обращению (по телефону, по электронной почте) 	<strong style="line-height:1.6">Действие Оператора:**\n\n</strong>1.  Уточните информацию по обращению (по телефону, по электронной почте (если пользователь обращался по электронной почте, уточните номер обращения));\n2.  Найдите обращение (по номеру или другим реквизитам);\n3.  Сообщите, на какой стадии рассмотрения оно находится. При необходимости свяжитесь с Ответственным и уточните подробности по запросу Клиента.	Editorial
Звонок Поставщика на линию Заказчиков	Если пользователь - Поставщик, предоставить ответ. Для обслуживания участников выделена отдельная группа специалистов. Вам необходимо в голосовом меню нажать цифру 2.	Editorial
Звонок клиенту по просьбе менеджера	1.  Уточняет все необходимые контактные данные Пользователя (Контактные данные Менеджера уточняются при необходимости уведомить о результате звонка);\n2.  Уточняет в чем заключается сложность, при выполнении каких действий;\n3.  Связывается с Пользователем и помогает в разрешении обращения;\n4.  При необходимости сообщает Менеджеру о результатах звонка Пользователю.	Editorial
Подтверждение предоставления ответа на запрос КО  	1.  Уточните информацию по запросу (Номер запроса, дата отправки, в отношении какой процедуры подан запрос,на какой адрес был отправлен запрос);\n2.  Поставьте задачу по шаблону "Предоставление информации по запросу контролирующего органа", указав информацию по запросу в поле "Суть задачи".	Editorial
Предоставление информации об обучающих мероприятиях	**Ответ Оператора:  **Для получения информации об обучающих мероприятиях Вам необходимо обратиться на адрес электронной почты [academy@rts-tender.ru](mailto:academy@rts-tender.ru).	Editorial
