Question	Answer	Source
Просмотр экономии по проведенным аукционам	"Экономию по проведенным аукционам Вы можете просмотреть в разделе "Мои контракты" Личного кабинета. В столбце "Экономия" отображается значение в валюте аукциона, в столбце "Экономия,%" / "Процент" - процентный эквивалент данного значения".	Editorial
Просмотр даты блокирования подписания контракта Заказчиком	**Ответ Оператора: "**При блокировании подписания контракта Заказчиком на срок 10 дней в Web-интерфейсе отображается только надпись "Заблокирована подпись контракта на срок 10 дней". 	Editorial
Публикация протокола отказа от заключения контракта	*   В форме протокола в поле "Причина отказа" Заказчик должен выбрать из выпадающего списка один из пунктов. Пояснения по причинам отказа от заключения контракта можно посмотреть в статье "<span style="color:#000000;font-family:calibri, arial, helvetica, sans-serif;font-size:14px;">[Причины отказа от заключения контракта](http://vtiger.sibir.rts-tender/index.php?module=Faq&parenttab=Support&action=DetailView&record=3774800)</span>";\n*   В форме протокола в поле "Основание отказа" Заказчик должен выбрать из выпадающего списка один из пунктов (см. статью "<span style="color:#000000;font-family:calibri, arial, helvetica, sans-serif;font-size:14px;">[Виды оснований отказа от заключения контракта](http://vtiger.sibir.rts-tender/index.php?module=Faq&parenttab=Support&action=DetailView&record=3006633)</span>");\n*   Если Заказчик выбирает причину отказа: "Признать Участника уклонившимся от заключения контракта", в форме протокола отказа появится дополнительное поле для выбора аукционной комиссии. Выбор комиссии является не обязательным. Поле "Основание отказа" в протоколе отказа становится обязательным для заполнения;\n*   Создать протокол отказа от заключения контракта может только Заказчик, у Организатора торгов такой возможности нет;\n*   Если уклонившимся признается Участник, получивший на площадке кредит на обеспечение заявки, при публикации протокола Заказчику системой будет выдано сообщение "Произошла ошибка при подписании. Пожалуйста, свяжитесь с оператором площадки". В этом случае Оператору необходимо поставить соответствующую задачу в Мегаплане, в задаче указать: ИНН и наименование организации Заказчика и Участника, номер аукциона. После того, как ответственным специалистом проблема будет решена, Оператору необходимо связаться с пользователем Заказчика и убедиться, что все действия на площадке получилось выполнить.1.  В Личном кабинете перейдите в раздел "Мои контракты";\n2.  Откройте нужный контракт;\n3.  В карточке контракта внизу страницы нажмите кнопку "Сформировать протокол отказа от заключения контракта";\n4.  Затем кнопку "Ок";\n5.  В появившемся окне пропишите без кавычек фразу "Я отказываюсь заключать контракт", нажмите кнопку "Ок";\n6.  В форме протокола отказа от заключения контракта заполните все обязательные поля;\n7.  Нажмите кнопку "Прикрепить документ", через "Обзор" выберите документ и нажмите кнопку "Сохранить";\n8.  Нажмите кнопку "Подписать и опубликовать";\n9.  В открывшемся окне проверьте корректность заполнения формы, нажмите кнопку "Подписать и опубликовать", затем кнопку "Ок".	Editorial
Внесение изменений в опубликованный протокол отказа от заключения контракта	Условия:*   Внести изменения в опубликованный протокол отказа от заключения контракта возможно только один раз;\n*   Внесение изменений в опубликованный протокол отказа от заключения контракта возможно до 21.00 часа  (по московскому времени) календарного дня, следующего за днем публикации изменяемого протокола;\n*   Просто заменить файл протокола отказа возможности нет, необходимо вносить изменения во всю форму протокола отказа от заключения контракта.В случае если Вы нажмете кнопку "Изменить" и повторно не опубликуете протокол, автоматической публикации не произойдет, протокол останется в статусе "Формирование"."Для внесения изменений в протокол отказа от заключения контракта:1.  Войдите в Личный кабинет;\n2.  Перейдите в раздел "Мои аукционы" и откройте нужный контракт;\n3.  Откройте форму протокола отказа от заключения контракта;\n4.  Нажмите кнопку "Отмена";\n5.  Укажите причину отказа;\n6.  Статус протокола изменится на «Формирование». Форма станет активной для редактирования. Вы сможете внести необходимые изменения;\n7.  Нажмите кнопку "Сформировать новый протокол отказа от заключения контракта", далее "Ок";\n8.  Повторно опубликуйте протокол отказа от заключения контракта. Механизм публикации протокола отказа от заключения контракта не меняется (см.ст. "[Публикация протокола отказа от заключения контракта](http://vtiger.sf.rts-tender.ru/index.php?module=Faq&parenttab=Support&action=DetailView&record=2331038)")	Editorial
Виды оснований отказа от заключения контракта 	"Основанием для отказа от заключения контракта может быть:*   Проведение ликвидации Участников размещения заказа;\n*   Принятие решения о признании Участников размещения заказа банкротами и об открытии конкурсного производства;\n*   Приостановление деятельности в порядке, предусмотренном Кодексом РФ об административных нарушениях;\n*   Предоставление заведомо ложных сведений, содержащихся в документах;\n*   Нахождение имущества под арестом;\n*   Наличие задолженности по начисленным налогам, сборам и иным обязательным платежам в бюджеты ли иные государственные внебюджетные формы;\n*   Уклонение от заключения государственного (муниципального) контракта;\n*   Наличие информации о об отсутствии в реестре недобросовестных поставщиков (подрядчиков, исполнителей) информации об участнике закупки, в том числе информации об учредителях, о членах коллегиального исполнительного органа, лице, исполняющем функции единоличного исполнительного органа участника закупки - юридического лица;\n*   Несоответствие участника закупки дополнительным требованиям в соответствии с ч. 2, ч. 2.1 ст. 31 Закона № 44-ФЗ.	Editorial
Заключение контракта в случае ошибочного признания Участника уклонившимся 	 "В случае ошибочного признания участника уклонившимся, заключить контракт возможности нет."	Editorial
Изменение причины отказа от заключения контракта 	"В соответствии с 44-ФЗ изменение причины отказа от заключения контракта не предусмотрено. <span style="line-height:1.6">Внести изменение в опубликованный протокол отказа от заключения контракта возможно только до 21.00 часа (по московскому времени) календарного дня, следующего за днем публикации изменяемого протокола (см. статью "</span>[Внесение изменений в опубликованный протокол отказа от заключения контракта](http://vtiger.sibir.rts-tender/index.php?module=Faq&parenttab=&action=DetailView&record=2941967)<span style="line-height:1.6">"). Отмена протокола осуществляется только по решению Контролирующего органа.</span>	Editorial
Просмотр протокола отказа от заключения контракта	"Для просмотра протокола отказа от заключения контракта:1.  Войдите в Личный кабинет;\n2.  Перейдите в раздел "Мои аукционы" и откройте нужный аукцион;\n3.  Нажмите кнопку "Открыть протокол отказа от заключения контракта" в нижней части страницы.Просмотр протокола отказа от заключения контракта из открытой части площадки:1.  Перейдите в раздел "Поиск аукционов" (раздел "Закупки" или простой поиск);\n2.  Найдите и откройте нужный аукцион;\n3.  В разделе "История" в нижней части страницы откройте протокол отказа, кликнув на его название.	Editorial
Отмена опубликованного протокола отказа от заключения контракта	"После публикации протокола отказа от заключения контракта в карточке протокола появляется кнопка "Отмена", которая доступна Заказчику до 21:00 по московскому времени дня следующего за датой публикации протокола отказа от заключения контракта.Порядок выполнения действий:1.  Войдите в Личный кабинет под электронной подписью и перейдите в раздел "Мои аукционы". Откройте нужное извещение и во вкладке "Протоколы" нажмите на кнопку"Открыть протокол отказа от заключения контракта";\n2.  В форме протокола отказа нажмите кнопку "Отмена";\n3.  В открывшемся окне введите причину отмены протокола и подтвердите отмену при помощи кнопки "Ок". Протокол перейдет в статус "Формирование" и в форме протокола появится кнопка "Сформировать новый протокол отказа от заключения контракта".	Editorial
Просмотр документов, прикрепленных к карточке контракта в статусе "Отказ от заключения контракта", если создана карточка со вторым Участником	"Для просмотра документов:1.  Зайдите в Личный кабинет по электронной подписи;\n2.  Перейдите в раздел "Контракты", найдите необходимый и откройте сведения о нем;\n3.  Все документы, прикрепленные в карточке этого контракта будут отображаться во вкладке "Документация".	Editorial
Удаление протокола отказа от заключения контракта в статусе "Формирование" 	В случае если протокол отказа находится в статусе "Формирование", удалить данный протокол невозможно. Протокол отказа отображается только у Заказчиков в Личном кабинете. В открытом доступе протокол отказа выкладывается только после того, как протокол будет опубликован (статус протокола отказа изменится на "Опубликован").	Editorial
Необходимость публикации протокола отказа от заключения контракта со вторым Участником 	 "44-ФЗ предусмотрено право второго Участника отказаться от заключения контракта без внесения сведений о нем в РНП. Денежные средства для обеспечения заявки у второго Участника не блокируются. Поэтому создавать протокол отказа от заключения контракта не требуется." 	Editorial
Просмотр протокола отказа от заключения контракта вторым Участником	"Просмотр информации по протоколу отказа:*   **В уведомлении.** При публикации протокола отказа от заключения контракта Организатору торгов, Заказчику и Участнику по системе обратной связи и на электронную почту направляется уведомление следующего содержания: "На основании ч. 15 ст. 70 №44-ФЗ Участник закупки "наименование Участника" отказывается о заключения контракта по причине "причина отказа";\n*   **В Личном кабинете Заказчика.** Протокол отказа от заключения контракта Участника доступен при переходе по ссылке "Открыть протокол отказа от заключения контракта" в карточке контракта. Информация о публикации протокола отказа от заключения контракта Участника фиксируется в карточке контракта в "Истории изменений";\n*   **В открытой части площадки.** Информация о публикации протокола отказа от заключения контракта Участника размещается в открытой части площадки. Протокол отказа от заключения контракта Участника доступен в ЛК Поставщика в карточке контракта при нажатии кнопки "Открыть протокол отказа от заключения контракта".	Editorial
Признание Участника уклонившимся от подписания контракта	 "Для признания Участника уклонившимся от подписания контракта:1.  В карточке контракта нажмите кнопку "Признать участника уклонившимся";\n2.  В открывшейся форме "Протокол отказа от заключения контракта" заполните поля "Место составления протокола(Город)", "Основание отказа", "Причина отказа", "Реквизиты документов, подтверждающих основание для отказа", "Пояснения". Поле "Комиссия" не обязательно для заполнения;\n3.  Прикрепите документ, путем нажатия кнопки "Прикрепить документ";\n4.  Если протокол заполнен нажмите кнопку "Подписать и опубликовать" и подтвердите действие в диалоговом окне.Контракт изменит статус на "Участник признан уклонившимся от подписания контракта".	Editorial
Не интегрировалась отмена определения поставщика	В случае, если в ЕИС в общем доступе статус аукциона "отменен", при этом внутри извещения присутствует информация о дате отмены определения поставщика, а на Электронной площадке аукцион не отменен.	Editorial
Некорректное отображение информации о победителе в ЕИС	1.  В ЕИС с помощью фильтра найдите необходимый аукцион и откройте сведения о нем;\n2.  Перейдите в раздел "Результаты определения поставщика" и в столбце "Участник(и), с которыми планируется заключить контракт" просмотрите указанные сведения;\n3.  В АРМ Оператора с помощью фильтров найдите необходимую организацию и просмотрите сведения о контактном лице;\n4.  Если в  столбце "Участник(и), с которыми планируется заключить контракт" указано ФИО контактного лица (не ИП), поставьте задачу по шаблону "Некорректное отображение информации о победителе в ЕИС";\n5.  Предоставьте ответ Пользователю:"Со стороны площадки информацияв ЕИС была передана верно. Данные сведения были приняты ЕИС некорректно. Информация по Вашему обращению будет передана техническим специалистам, сведения о победителе будут переданы повторно."	Editorial
Не интегрировался протокол в ЕИС	1.  Уточните вид документа, номер аукциона;\n2.  Проверьте информацию в АРМ Оператора (статус протоколов – если не переданы данные по протоколам);\n3.  Проверьте информацию на ЕИС (при проблеме интеграции с площадки: в форме извещения по аукциону во вкладке "Документы закупки" - подраздел "Протоколы работы комиссии");\n4.  Обращение не разрешать (заявка остается открытой);\n5.  Предоставьте ответ Заказчику;\n6.  Поставьте задачу в Мегаплане. В задаче укажите:*   Суть проблемы;\n*   Номер аукциона;\n*   Сведения, которые не были интегрированы на ЕИС.1.  При необходимости можете уточнить информацию по дате первичной отправки сведений на ЕИС у 2 линии техподдержки СФ."Сведения на Официальный сайт были переданы вовремя. Причины, по которым ЕИС сведения не были приняты - пока неизвестны. Информация будет передана техническим специалистам и отправлена повторно. Нормативное время интеграции – от 2 часов до суток, время поступления информации зависит от ЕИС.";	Editorial
Не интегрировался аукцион	1.  Уточните номер аукциона;\n2.  По номеру аукциона проверьте наличие сведений о данном извещении на площадке (в АРМ Оператора в разделе "Извещения РТС-тендер" или в открытой части площадки в разделе "Поиск аукционов");\n3.  Уточните дату публикации извещения;\n4.  Проверьте информацию в ЕИС (для поиска извещения можно воспользоваться разделом "Все заказы и закупки", при этом в подразделе "Этап размещения заказа" проставьте галочки во все чек-боксы. В извещении в поле "Наименование площадки" должно быть указано значение "РТС-тендер");\n5.  Предоставьте ответ Заказчику:Прошло менее суток. Ответ Оператора "Нормативное время интеграции составляет от 2 часов до суток".Прошло более суток, но на площадку сведения не были переданы, поставьте задачу в Мегаплане. В задаче укажите:*   Суть проблемы;\n*   Номер извещения;\n*   Дату публикации извещения на Официальном сайте.**Ответ Оператора**: "Время поступления сведений на площадку зависит от Официального сайта. Причины, по которым с Официального сайта на площадку не были переданы сведения об извещении, Вам необходимо уточнять в службе технической поддержки сайта http://zakupki.gov.ru. Площадка со своей стороны предпримет все необходимые действия для решения данного вопроса".	Editorial
